{
  "$schema": "https://json-schema.org/draft/2020-12/schema",
  "$id": "https://harness.local/schemas/provider-manifest.v1.json",
  "title": "Harness Provider Manifest",
  "type": "object",
  "additionalProperties": false,
  "required": [
    "schema_version",
    "id",
    "name",
    "provider_type",
    "adapter_version",
    "supported_os",
    "capabilities",
    "auth_strategy",
    "install_strategy",
    "update_strategy",
    "usage_strategy"
  ],
  "properties": {
    "schema_version": { "const": 1 },
    "id": { "type": "string", "pattern": "^[a-z][a-z0-9.-]{2,63}$" },
    "name": { "type": "string", "minLength": 1, "maxLength": 80 },
    "provider_type": {
      "enum": ["CLI_PROVIDER", "HTTP_PROVIDER", "LOCAL_RUNTIME_PROVIDER", "CUSTOM_PROVIDER"]
    },
    "adapter_version": { "type": "string", "pattern": "^[0-9]+\\.[0-9]+\\.[0-9]+" },
    "binary_candidates": {
      "type": "array",
      "items": { "type": "string", "minLength": 1 },
      "uniqueItems": true
    },
    "supported_os": {
      "type": "array",
      "items": { "enum": ["macos", "windows", "linux"] },
      "minItems": 1,
      "uniqueItems": true
    },
    "capabilities": {
      "type": "array",
      "items": {
        "enum": [
          "coding",
          "reasoning",
          "company_search",
          "file_access",
          "shell",
          "git",
          "tool_calling",
          "vision",
          "long_context",
          "local",
          "offline",
          "cheap",
          "fast",
          "parallel_agents",
          "session_resume"
        ]
      },
      "uniqueItems": true
    },
    "auth_strategy": {
      "enum": ["INHERIT_CLI_SESSION", "OAUTH_PKCE_OS_STORE", "NONE", "CUSTOM"]
    },
    "install_strategy": {
      "enum": ["VENDOR_NATIVE", "APP_MANAGED", "HOMEBREW", "WINGET", "EXTERNAL", "CUSTOM"]
    },
    "update_strategy": {
      "enum": ["VENDOR_OR_PACKAGE_MANAGER", "SIGNED_APP_MANAGED", "NOTIFY_ONLY", "CUSTOM"]
    },
    "usage_strategy": {
      "enum": ["EVENT_STREAM", "REQUEST_COUNT", "LOCAL_RUNTIME_METRICS", "UNAVAILABLE", "CUSTOM"]
    },
    "minimum_version": { "type": ["string", "null"] },
    "tested_through": { "type": ["string", "null"] },
    "models": {
      "type": "array",
      "items": {
        "type": "object",
        "additionalProperties": false,
        "required": ["id", "discovery"],
        "properties": {
          "id": { "type": "string" },
          "display_name": { "type": "string" },
          "discovery": { "enum": ["STATIC", "DYNAMIC", "USER_CONFIGURED"] },
          "capabilities": {
            "type": "array",
            "items": { "type": "string" },
            "uniqueItems": true
          }
        }
      }
    },
    "metadata": { "type": "object" }
  }
}
