{
  "$schema": "./manifest.schema.json",
  "schema_version": 1,
  "id": "microsoft.m365-copilot",
  "name": "Microsoft 365 Copilot",
  "provider_type": "HTTP_PROVIDER",
  "adapter_version": "0.1.0",
  "binary_candidates": [],
  "supported_os": ["macos", "windows"],
  "capabilities": ["company_search", "reasoning", "long_context", "session_resume"],
  "auth_strategy": "OAUTH_PKCE_OS_STORE",
  "install_strategy": "EXTERNAL",
  "update_strategy": "SIGNED_APP_MANAGED",
  "usage_strategy": "REQUEST_COUNT",
  "minimum_version": null,
  "tested_through": null,
  "models": [
    {
      "id": "tenant-managed",
      "display_name": "Microsoft 365 Copilot",
      "discovery": "STATIC",
      "capabilities": ["company_search", "reasoning"]
    }
  ],
  "metadata": {
    "api_maturity": "preview",
    "conversation_endpoint": "https://graph.microsoft.com/beta/copilot/conversations",
    "application_permissions_supported": false,
    "actions_supported": false,
    "credential_store": "operating-system"
  }
}
