{
  "$schema": "../../providers/manifest.schema.json",
  "schema_version": 1,
  "id": "harness.reference-generic",
  "name": "Generic Reference Provider",
  "provider_type": "CLI_PROVIDER",
  "adapter_version": "0.1.0",
  "binary_candidates": ["node", "node.exe"],
  "supported_os": ["macos", "windows", "linux"],
  "capabilities": [
    "reasoning",
    "local",
    "offline",
    "cheap",
    "fast",
    "session_resume"
  ],
  "auth_strategy": "NONE",
  "install_strategy": "CUSTOM",
  "update_strategy": "CUSTOM",
  "usage_strategy": "EVENT_STREAM",
  "minimum_version": "22.0.0",
  "tested_through": "22.22.1",
  "models": [
    {
      "id": "reference-echo-v1",
      "display_name": "Deterministic Reference Echo",
      "discovery": "STATIC",
      "capabilities": [
        "reasoning",
        "local",
        "offline",
        "cheap",
        "fast",
        "session_resume"
      ]
    }
  ],
  "metadata": {
    "credential_access": "forbidden",
    "entrypoint": "node adapter.mjs",
    "network_access": "forbidden",
    "shell_access": "forbidden",
    "workspace_io": "none",
    "transport": "jsonrpc-2.0-jsonl-stdio"
  }
}
